WALIS reference ID,Reference,Full reference,Journal,Year,doi,Link,Nation,Language,Timeframe,Record created by,Record updated by,Last Update,Type of paper
1365,Pirazzoli et al. 1993,"Pirazzoli, P. A., Radtke, U., Hantoro, W. S., Jouannic, C., Hoang, C. T., Causse, C. & Best, B. 1993 A one million-year-long sequence of marine terraces on Sumba Island, Indonesia. Mar.
Geol. 109, 221–236.",Marine Geology,1993,https://doi.org/10.1016/0025-3227(93)90062-Z,,93,EN,"Pleistocene,MIS 5",Gilbert Camoin,,2020-04-29 09:13:47,Review
13,"Pirazzoli et al., 1988","Pirazzoli, P. A., M. Koba, L. F. Montaggioni, and A. Person, 1988, Anaa (Tuamotu Islands, Central Pacific): An incipient rising atoll?: Marine Geology, v. 82 (3-4), p. 261-269.",Marine Geology,1988,https://doi.org/10.1016/0025-3227(88)90145-4,,162,EN,Holocene,Deirdre Ryan,Ann-Kathrin Petersen,2019-05-24 11:42:30,
553,"Pirazzoli et al., 1991","Pirazzoli, P. A., J. Laborel, J. F. Saliège, O. Erol, I. c. d. a. Kayan, and A. Person, 1991, Holocene raised shorelines on the Hatay coasts (Turkey): Palaeoecological and tectonic implications: Marine Geology, v. 96, p. 295-311.",Marine Geology,1991,https://doi.org/10.1016/0025-3227(91)90153-U,,207,EN,Holocene,Deirdre Ryan,Ann-Kathrin Petersen,2019-07-20 13:32:53,
1721,"Pirazzoli et al., 1991b","Pirazzoli P.A., Radtke U., Hantoro W.S., Jouannic C., Hoang C.T., Causse C., Best M.B., 1991. Quaternary Raised Coral-Reef Terraces on Sumba Island, Indonesia. Science 252 : 1834–1836. DOI: 10.1126/science.252.5014.1834\r\n",Science,1991,10.1126/science.252.5014.1834,,93,EN,,Kathrine Maxwell,,2020-12-10 07:55:27,
829,"Pirazzoli et al., 1993","Pirazzoli, P. A., U. Radtke, W. S. Hantoro, C. Jouannic, C. T. Hoang, C. Causse, and M. B. Best, 1993, A one million-year-long sequence of marine terraces on Sumba Island, Indonesia: Marine Geology, v. 109, p. 221-236.",Marine Geology,1993,https://doi.org/10.1016/0025-3227(93)90062-Z,,93,EN,"Holocene,Pleistocene,MIS 9",Deirdre Ryan,Ann-Kathrin Petersen,2019-07-25 08:30:04,
796,"Pirazzoli et al., 2004","Pirazzoli, P. A., J.-L. Reyss, M. Fontugne, A. Haghipour, A. Hilgers, H. U. Kasper, H. Nazari, F. Preusser, and U. Radtke, 2004, Quaternary coral-reef terraces from Kish and Qeshm Islands, Persian Gulf: new radiometric ages and tectonic implications: Quaternary International, v. 120, p. 15-27.",Quaternary International,2004,https://doi.org/10.1016/j.quaint.2004.01.003,,98,EN,"Holocene,Pleistocene,MIS 5,MIS 7",Deirdre Ryan,Ann-Kathrin Petersen,2019-07-25 07:00:29,
22,"Pirazzoli, 1994","Pirazzoli, P. A., 1994, Tectonic shorelines, in R. W. G. Carter, and C. D. Woodroffe, eds., Coastal Evolution : Late Quaternary shoreline morphodynamics: Edinburgh, Cambridge University Press, p. 517.",Coastal Evolution: Late Quaternary shoreline morphodynamics,1994,https://doi.org/10.1017/CBO9780511564420,https://www.worldcat.org/title/coastal-evolution-late-quaternary-shoreline-morphodynamics/oclc/30032,999,EN,"Holocene,Pleistocene",Deirdre Ryan,Ann-Kathrin Petersen,2019-07-31 09:16:13,
1069,"Pirazzoli, 2005","Pirazzoli, P.A., 2005. Marine terraces. Encyclopedia of Coastal Science, pp.632-633.",Encyclopedia of Coastal Science,2005,https://doi.org/10.1007/1-4020-3880-1_209,,999,EN,,Alessio Rovere,Ann-Kathrin Petersen,2019-07-28 04:17:56,
784,"Plaziat et al., 1995","Plaziat, J.-C., F. Baltzer, A. Choukri, O. Conchon, P. Freytet, F. Orszag-Sperber, B. Purser, A. Raguideau, and J.-L. Reyss, 1995, Quaternary changes in the Egyptian shoreline of the Northwestern Red Sea and Gulf of Suez: Quaternary International, v. 29-30, p. 11-22.",Quaternary International,1995,https://doi.org/10.1016/1040-6182(95)00003-2,,59,EN,"Holocene,Pleistocene,MIS 5",Deirdre Ryan,Ann-Kathrin Petersen,2019-07-23 14:34:56,
712,"Plaziat et al., 2006","Plaziat, J.-C., M. Aberkan, and J.-L. Reyss, 2006, New late Pleistocene seismites in a shoreline series including eolianites, north of Rabat (Morocco): Bulletin de la Société Géologique de France, v. 177 (6), p. 323-332.",Bulletin de la Société Géologique de France,2006,https://doi.org/10.2113/gssgfbull.177.6.323,,126,EN,"Pleistocene,MIS 5",Deirdre Ryan,Ann-Kathrin Petersen,2019-07-23 06:42:18,
713,"Plaziat et al., 2008","Plaziat, J.-C., M. Aberkan, M. Ahmamou, and A. Choukri, 2008, The Quaternary Deposits of Morocco, Continental Evolution: The Geology of Morocco, p. 359-376.",The Geology of Morocco,2008,https://doi.org/10.1007/978-3-540-77076-3_8,,126,EN,"Holocene,Pleistocene",Deirdre Ryan,Ann-Kathrin Petersen,2019-07-23 06:45:00,
144,"Polenz and Kelsey, 1999","Polenz, M., and H. M. Kelsey, 1999, Development of a Late Quaternary Marine Terraced Landscape during On-Going Tectonic Contraction, Crescent City Coastal Plain, California: Quaternary Research, v. 52 (2), p. 217-228.",Quaternary Research,1999,https://doi.org/10.1006/qres.1999.2061,,230,EN,"Holocene,Pleistocene",Deirdre Ryan,Ann-Kathrin Petersen,2019-05-28 09:12:54,
1238,"Polyak et al., 2018","Polyak, V.J., Onac, B.P., Fornós, J.J., Hay, C., Asmerom, Y., Dorale, J.A., Ginés, J., Tuccimei, P. and Ginés, A., 2018. A highly resolved record of relative sea level in the western Mediterranean Sea during the last interglacial period. Nature Geoscience, 11(11), pp.860-864.",Nature Geoscience,2018,https://doi.org/10.1038/s41561-018-0222-5,,62,EN,,WALIS Admin,,2020-03-14 17:28:14,RSL indicators source
554,"Poole and Robertson, 1991","Poole, A. J., and H. F. Robertson, 1991, Quaternary uplift and sea-level change at an active plate boundary, Cyprus: Journal of the Geological Society, v. 148, p. 909-921.",Journal of the Geological Society,1991,https://doi.org/10.1144/gsjgs.148.5.0909,,49,EN,"Holocene,Pleistocene",Deirdre Ryan,Ann-Kathrin Petersen,2019-07-20 13:35:26,
550,"Poole et al., 1990","Poole, A. J., G. B. Shimmield, and H. F. Roberstson, 1990, Late Quaternary uplift of the Troodos Ophiolite, Cyprus; uranium-series dating of Pleistocene coral: Geology, v. 18, p. 894-897.",Geology,1990, https://doi.org/10.1130/0091-7613(1990)018<0894:LQUOTT>2.3.CO;2,,49,EN,"Holocene,Pleistocene",Deirdre Ryan,Ann-Kathrin Petersen,2019-07-20 13:20:32,
1662,"Poole et al., 1990a","Poole, A.J., Shimmield, G., and Robertson, A.H.F. (1990). Late Quaternary uplift of the Troodos ophiolite, Cyprus; Uranium-series dating of Pleistocene coral, Geology 18: pp. 894-897",Geology,1990,10.1130/0091-7613(1990)018<0894,https://pubs.geoscienceworld.org/gsa/geology/article-abstract/18/9/894/205161/Late-Quaternary-uplift,49,EN,Pleistocene,Zomenia Zomeni,Zomenia Zomeni,2020-10-30 09:12:25,Age techniques
1663,"Poole, 1992","Poole, A. 1992, Sedimentology, neotectonics and geomorphology related to tectonic uplift and sea-level change: Quaternary of Cyprus, PhD thesis, University of Edinburgh. 526 p.","Sedimentology, neotectonics and geomorphology related to tectonic uplift and sea-level change: Quaternary of Cyprus",1992,,https://era.ed.ac.uk/handle/1842/12788,49,EN,Pleistocene,Zomenia Zomeni,,2020-10-30 13:25:41,Age techniques
1324,"Porat and Botha, 2008","Porat,  N.  and  Botha,  G.A.  2008.  The  luminescence  chronology  of  dune development   on   the   Maputaland   coastal   plain,   southeast   Africa. Quaternary Science Reviews, 27, 1024-1046. ",,2008,,,,EN,,Andrew Cooper,,2020-04-08 06:37:58,
2101,"Porter et al., 1992","
Porter, S.C., Clapperton, C.M., Sugden, D.E., (1992) 'Chronology and dynamics of deglaciation along and near the Strait of Magellan, southernmost South America'.","Geological Survey of Sweden. Series Ca. Research paper. 1992, Num 81, pp 233-239",1992,,https://pascal-francis.inist.fr/vibad/index.php?action=getRecordDetail&idt=4926859,10,EN,,Abdullah Saeed,,2021-10-27 13:44:02,
1463,"Potter and Lambeck, 2004","Potter, E.K., Lambeck, K., 2004, Reconciliation of sea-level observations in the Western North Atlantic during the last glacial cycle: Earth and Planetary Science Letters, v. 217, p. 171–181. ",Earth and Planetary Science Letters,2004,10.1016/S0012-821X(03)00587-9,https://www.sciencedirect.com/science/article/abs/pii/S0012821X03005879,,EN,MIS 5,Jessica Creveling and Schmitty Thompson,,2020-07-03 19:57:56,Review
320,"Potter et al.,2004","Potter, E.-K., T. M. Esat, G. Schellmann, U. Radtke, K. Lambeck, and M. T. McCulloch, 2004, Suborbital-period sea-level oscillations during marine isotope substages 5a and 5c: Earth and Planetary Science Letters, v. 225 (1-2), p. 191-204.",Earth and Planetary Science Letters,2004,https://doi.org/10.1016/j.epsl.2004.05.034,,16,EN,"Pleistocene,MIS 5",Deirdre Ryan,Ann-Kathrin Petersen,2019-06-28 04:08:27,
1733,"Poujol et al., 2014","Poujol, A., Ritz, J.-F., Tahayt, A., Vernant, P., Condomines, M., Blard, P.H., Billant, J., Vacher, L., Tibari, B., Hni, L., Koulali Idrissi, A., 2014. Active tectonics of the Northern Rif (Morocco) from geomorphic and geochronological data. Journal of Geodynamics 77, pp. 70-88.",Journal of Geodynamics,2014,,,,EN,,Ciro Cerrone,,2021-01-12 08:47:11,
1165,"Poupeau et al., 1988","Poupeau, G., Jr. E. Soliani, A. Rivera, E.L. Loss, and M.B.A. Vasconcellos, 1988, Datação por termoluminescência de alguns depósitos arenosos costeiros do último ciclo climático no Nordeste do RS, Brasil. ",Pesquisas,1988,https://doi.org/10.22456/1807-9806.21464,,27,Other,"Holocene,Pleistocene",Karla Zurisadai Rubio Sandoval ,,2020-01-27 05:54:11,Age techniques
1389,"Powers, 1962","Powers, W.E. (1962) Terraces of the Hurunui River, New Zealand. New Zealand Journal of Geology and Geophysics, 5 (1), 114-129.",New Zealand Journal of Geology and Geophysics,1962,,https://www.tandfonline.com/doi/abs/10.1080/00288306.1962.10420113,158,EN,,Deirdre Ryan,,2020-05-11 10:54:32,
810,"Prasad and Gupta, 1999","Prasad, S., and S. K. Gupta, 1999, Role of Eustasy, climate and tectonics in late Quaternary evolution of Nal-Cambay region, NW India: Zeitschrift für Geomorphologie, v. 43, p. 483-504.",Zeitschrift für Geomorphologie,1999,,,96,EN,"Holocene,Pleistocene",Deirdre Ryan,Ann-Kathrin Petersen,2019-07-25 07:36:16,
1808,Preece 1999 JQS,"Preece, R.C., 1999. Mollusca from last interglacial fluvial deposits of the river Thames at Trafalgar Square, London. Journal of Quaternary Science: Published for the Quaternary Research Association, 14(1), pp.77-89.",Journal of Quaternary Science,1999,https://doi.org/10.1002/(SICI)1099-1417(199902)14:1<77::AID-JQS399>3.0.CO;2-U,https://onlinelibrary.wiley.com/doi/10.1002/(SICI)1099-1417(199902)14:1%3C77::AID-JQS399%3E3.0.CO;2-,71,EN,,Natasha Barlow,,2021-03-17 14:44:31,RSL indicators source
1875,"Preece et al., 1990","Preece, R. C., Scourse, J. D., Houghton, S. D., Knudsen, K. L., & Penney, D. N. (1990). The Pleistocene sea-level and neotectonic history of the eastern Solent, southern England. Philosophical Transactions of the Royal Society of London. B, Biological Sciences, 328(1249), 425-477.","Philosophical Transactions of the Royal Society of London. B, Biological Sciences",1990,https://doi.org/10.1098/rstb.1990.0120,,71,EN,Pleistocene,Víctor Cartelle,,2021-05-24 16:01:16,Age techniques
1756,"Prest et al., 1976","Prest, V. K., Terasme, J., Matthews, Jr., J. V., & Lichti-Federovich, S. (1976). Late-Quaternary History of Magdalen Islands, Quebec. Atlantic Geology, 12(2), pp. 39-59.",Atlantic Geology,1976,10.4138/1835,,33,EN,MIS 5,Evan Gowan,,2021-02-01 17:13:23,RSL indicators source
426,"Prestwich, 1892","Prestwich, J., 1892, The Raised Beaches, and 'Head' or Rubble-drift, of the South of England: their Relation to the Valley Drifts and to the Glacial Period; and on a late post-Glacial Submergence: Quarterly Journal of the Geological Society, v. 48 (1-4), p. 263-343.",Quarterly Journal of the Geological Society,1892,https://doi.org/10.1144/GSL.JGS.1892.048.01-04.19,,71,EN,Pleistocene,Deirdre Ryan,Ann-Kathrin Petersen,2019-07-02 09:18:58,
794,"Preusser et al., 2003","Preusser, F., U. Radtke, M. Fontugne, A. Haghipour, A. Hilgers, H. U. Kasper, H. Nazari, and P. A. Pirazzoli, 2003, ESR dating of raised coral reefs from Kish Island, Persian Gulf: Quaternary Science Reviews, v. 22 (10-13), p. 1317-1322.",Quaternary Science Reviews,2003,https://doi.org/10.1016/S0277-3791(03)00038-6,,98,EN,,Deirdre Ryan,Ann-Kathrin Petersen,2019-07-23 15:40:29,
1475,"Preusser et al., 2005","Preusser, F., Andersen, B.G., Denton, G.H., Schluchter, C. (2005). Luminescence chronology of the Late Pleistocene glacial deposits in North Westland, New Zealand. Quaternary Science Reviews, 24, 2207-2227.",Quaternary Science Reviews,2005,10.1016/j.quascirev.2004.12.005,,158,EN,,Deirdre Ryan,,2020-07-06 18:49:23,Age techniques
1337,"Price, 1933","Price, W.A., (1933).  'Role of Diastrophism in Topography of Corpus Christi Area, Texas', American Association of Petroleum Geologists Bulletin 17, p. 907-962.",American Association of Petroleum Geologists Bulletin,1933,doi.org/10.1306/3D932B90-16B1-11D7-8645000102C1865D,https://pubs.geoscienceworld.org/aapgbull/article-abstract/17/8/907/545019/Role-of-Diastrophism-in-T,,EN,MIS 5,Alexander Simms,Alexander Simms,2020-04-10 15:46:54,RSL indicators source
2115,"Prieto et al., 2004","Prieto, A. R., Blasi, A. M., De Francesco, C. G. and Fernández, C. (2004) “Environmental history since 11,000 14c yr b.p. of the northeastern Pampas, Argentina, from alluvial sequences of the Luján River,” ","Quaternary Research. Cambridge University Press, 62(2), pp. 146–161",2004,10.1016/j.yqres.2004.04.006 ,https://www.cambridge.org/core/journals/quaternary-research/article/abs/environmental-history-since-,10,EN,Holocene,Abdullah Saeed,,2021-11-09 12:04:52,
2112,"Prieto et al., 2016","Prieto, A.R; Mourelle, D; Peltier, W.R; Drummond, R; Vilanova, I; Ricci, L (2016) 'Relative sea-level changes during the Holocene in the Río de la Plata, Argentina and Uruguay: A review'","Quaternary International Volume 442, Pages 35-49",2016,10.1016/j.quaint.2016.02.044,https://www.sciencedirect.com/science/article/pii/S104061821530104X,"10,214",EN,Holocene,Abdullah Saeed,,2021-10-27 16:43:19,RSL indicators source
1876,"Proctor and Smart, 1991","Proctor, C. J., & Smart, P. L. (1991). A dated cave sediment record of Pleistocene transgressions on Berry Head, Southwest England. Journal of Quaternary Science, 6(3), 233-244.",Journal of Quaternary Science,1991,https://doi.org/10.1002/jqs.3390060306,,71,EN,Pleistocene,Víctor Cartelle,,2021-05-24 16:03:22,Age techniques
1310,"Provansal et al., 1995_C.R. Acad. Se, Paris","Provansal, M., Quinif, Y., Verrecchia, É., & Arnaud, P. M. 1995. Identification d'un littoral tyrrhénien en bordure de l'étang de Berre (B-d-R., France mérid), C.R. Acad. Se, Paris, 320, ser. Ha, pp. 867-872.",,1995,,,,FR,,Matteo Vacchi,,2020-04-06 03:14:01,
1108,Pullar and Grant-Mackie 1972,"Pullar, W.A. and Grant-Mackie, J.A. (1972). Correlation of the Te Papa and Otamaroa Terraces, Eastern Bay of Plenty. New Zealand Journal of Geology and Geophysics, 15(1), 186-191.",New Zealand Journal of Geology and Geophysics,1972,,https://doi.org/10.1080/00288306.1972.10423962,158,EN,,Deirdre Ryan,,2019-09-12 06:46:45,
908,"Pullar and Grant-Mackie, 1972","Pullar, W. A., and J. A. Grant-Mackie, 1972, Correlation of the Te Papa and Otamaroa terraces, Eastern Bay of Plenty, New Zealand: Journal of Geology and Geophysics, v. 15 (1), p. 186-191.",Journal of Geology and Geophysics,1972,https://doi.org/10.1080/00288306.1972.10423962,,158,EN,Pleistocene,Deirdre Ryan,Ann-Kathrin Petersen,2019-07-26 11:11:31,
209,"Quezada et al., 2007","Quezada, J., G. Gonzalez, T. Dunai, A. Jensen, and J. Juez-Larr?, 2007, Alzamiento litoral Pleistoceno del norte de Chile: edades 21Ne de la terraza costera mas alta del area de Caldera-Bahia Inglesa: Revista Geologica de Chile, v. 34 (1), p. 81-96.",Revista Geologica de Chile,2007,http://dx.doi.org/10.4067/S0716-02082007000100005?,,41,ES,"Pleistocene,MIS 11",Deirdre Ryan,Ann-Kathrin Petersen,2019-05-30 09:37:18,
384,"Rabassa et al., 2000","Rabassa, J., Coronato, A., Bujalesky, G., Salemme, M., Roig, C., Meglioli, A., Heusser, C., Gordillo, S., Roig, F., Borromei, A. and Quattrocchio, M., 2000. Quaternary of Tierra del Fuego, southernmost South America: an updated review. Quaternary International, 68, pp.217-240.",Quaternary International,2000,https://doi.org/10.1016/S1040-6182(00)00046-X,,"10,41",EN,"Holocene,Pleistocene",Deirdre Ryan,Ann-Kathrin Petersen,2019-07-02 06:52:26,
367,"Rabassa et al., 2008","Rabassa, J., S. Gordillo, C. Ocampo, and P. Rivas Hurtado, 2008, The southernmost evidence for an interglacial transgression (Sangamon?) in South America. First record of upraised Pleistocene marine deposits in Isla Navarino (Beagle Channel, Southern Chile): Geologica Acta, v. 6 (3), p. 251-258.",Geologica Acta,2008,https://doi.org/10.1344/105.000000254,,41,EN,"Pleistocene,MIS 5",Deirdre Ryan,Ann-Kathrin Petersen,2019-06-28 05:32:37,
2123,"Rabassa et al., 2009","Rabassa, J; Coronato, A; Gordillo, S; Candel, M.S; Martinez, M.A ; (2009) ""Paleoambientes litorales durante el inicio de la trasgresión marina holocena en bahía Lapataia, canal Beagle, parque nacional Tierra del Fuego"".

",Revista de la Asociación Geológica Argentina 65 (4). pp. 648-659,2009,,http://www.scielo.org.ar/pdf/raga/v65n4/v65n4a06.pdf,10,ES,Holocene,Abdullah Saeed,,2021-11-25 17:48:13,
1519,"Radke, 1986","Rhodes, E.J., 1996. ESR dating of tooth enamel. In: Basile, B., Chilardi, S. (Eds.), Siracusa, le Ossa dei Giganti, lo scavo archeologico di Contrada Fusco. Lombardi, Palermo, pp. 39–44.","In: Basile, B., Chilardi, S. (Eds.)",1986,,,,IT,,Ciro Cerrone,,2020-08-12 20:35:52,
261,"Radtke and Grün, 1988","Radtke, U., and R. Grün, 1988, ESR dating of corals: Quaternary Science Reviews, v. 7 (3-4), p. 465-470.",Quaternary Science Reviews,1988,https://doi.org/10.1016/0277-3791(88)90047-9,,"16,221",EN,Pleistocene,Deirdre Ryan,Ann-Kathrin Petersen,2019-05-31 08:50:07,Age techniques
391,"Radtke and Schellmann, 1996","Radtke, U., and G. Schellmann, 1996, Comment on: Aguirre, M.L. and Whatley, R.C. (1995). Late quaternary marginal marine deposits and palaeoenvironments from northeastern Buenos Aires province, Argentina: A review. Quaternary science reviews, 14, 223-254: Quaternary Science Reviews, v. 15, p. 1061-1062.",Quaternary Science Reviews,1996,https://doi.org/10.1016/S0277-3791(96)00030-3,,10,EN,"Holocene,Pleistocene,Pliocene",Deirdre Ryan,Ann-Kathrin Petersen,2019-07-02 07:05:03,
332,"Radtke and Schellmann, 2006","Radtke, U., and G. Schellmann, 2006, Uplift history along the Clermont Nose Traverse on the west coast of Barbados during the last 500,000 years - implications for paleo-sea level reconstructions: Journal of Coastal Research, v. 22 (2), p. 350-356.",Journal of Coastal Research,2006,https://doi.org/10.2112/05-0439.1,,16,EN,Pleistocene,Deirdre Ryan,Ann-Kathrin Petersen,2019-06-28 04:31:37,
262,"Radtke et al., 1988","Radtke, U., R. Grün, and H. P. Schwarcz, 1988, Electron spin resonance dating of the Pleistocene coral reef tracts of Barbados: Quaternary Research, v. 29 (3), p. 197-215.",Quaternary Research,1988,https://doi.org/10.1016/0033-5894(88)90030-0,,16,EN,"Pleistocene,MIS 5,MIS 7,MIS 9,MIS 11",Deirdre Ryan,Ann-Kathrin Petersen,2019-05-31 08:51:43,Age techniques
1024,"Radtke et al., 1996","Radtke, U., R. Grün, A. Omura, and A. Mangini, 1996, The quaternary coral reef tracts of hateruma, Ryukyu Islands, Japan: Quaternary International, v. 31, p. 61-70.",Quaternary International,1996,https://doi.org/10.1016/1040-6182(95)00022-B,,103,EN,"Pleistocene,MIS 5,MIS 7",Deirdre Ryan,Ann-Kathrin Petersen,2019-07-27 09:28:44,
1930,"Radtke,  1986","Radtke, U. (1986). Value and risk of radiometric dating of shorelines-geomorphological and geochronological investigations in Central Italy, Eolian Islands and Ustica (Sicily). Zeitschrift für Geomorphologie. Supplementband, 62, 167-181.",Zeitschrift für Geomorphologie. Supplementband,1986,,,100,EN,Pleistocene,Alessio Rovere,,2021-06-23 08:51:09,RSL indicators source
1931,"Radtke, 1983","Radtke, U. (1983). Genese und Altersstellung der marinen Terrassen zwischen Civitavecchia und Monte Argentario (Mittelitalien) unter besonderer Berücksichtigung der Elektronenspin-Resonanz-Alterbestimmungsmethode.(Formation and datation of the marine terraces between Civitavecchia and Monte Argentario (Central Italy) based on the age determination method of the electron spin resonance). Düsseldorfer geographische Schriften Düsseldorf, (22), 1-182.",Düsseldorfe Geographische Schriften,1983,,,100,Other,Pleistocene,Alessio Rovere,,2021-06-23 08:55:45,RSL indicators source
171,"Radtke, 1987","Radtke, U., 1987, Palaeo sea levels and discrimination of the Last and the Penultimate interglacial fossiliferous deposits deposits by absolute dating methods and geomorphological investigations illustrated from marine terraces in Chile in Hofmeister, B. and Voss, F. eds: Beiträge zur Geographie der Küsten und Meere. Sylt 1986 und Berlin 1987. In: Berliner geographische Studien, v. 25, p. 313-342.","Hofmeister, B. and Voss, F., eds.: Beiträge zur Geographie der Küsten und Meere. Sylt 1986 und Berlin 1987. In: Berliner geographische Studien, Bd. 25, Berlin.",1987,,https://www.worldcat.org/title/beitrage-zur-geographie-der-kusten-und-meere-sylt-1986-und-berlin-198,41,EN,"Pleistocene,MIS 5,MIS 7",Deirdre Ryan,Ann-Kathrin Petersen,2019-07-31 10:36:06,
401,"Radtke, 1989","Radtke, U., 1989. Marine Terrassen und Korallenriffe: das Problem der quartären Meeresspiegelschwankungen erläutert an Fallstudien aus Chile, Argentinien und Barbados (No. 27). Im Selbstverlag des Geographischen Institutes der Heinrich-Heine-Universität Düsseldorf.",Dusseldorfer Geographische Schriften,1989,,,"10,16,41",Other,,Deirdre Ryan,Ann-Kathrin Petersen,2019-07-02 07:18:40,
172,"Radtke, 1989","Radtke, U., 1989, Marine Terrassen und Korallenriffe. Das Problem der Quartären Meeresspiegelschwankungen erläutert an Fallstudien aus Chile, Argentinien und Barbados: Düsseldorfer Geographische Schriften, v. 27, p. 245.",Düsseldorfer Geographische Schriften,1989,,https://www.worldcat.org/title/marine-terrassen-und-korallenriffe-das-problem-der-quartaren-meeressp,"10,16,41",Other,"Holocene,Pleistocene",Deirdre Ryan,Ann-Kathrin Petersen,2019-07-31 10:38:56,
160,Ramirez-Herrera,"Ramirez-Herrera, M.-T., V. Kostoglodov, and J. Urrutia-Fucugauchi, 2011, Overview of recent coastal tectonic deformation in the Mexican Suduction zone: Pure and Applied Geophysics, v. 168 (8-9), p. 1415-1433.",Pure and Applied Geophysics,2011,DOI 10.1007/s00024-010-0205-y,,144,EN,"Holocene,Pleistocene",Deirdre Ryan,Ann-Kathrin Petersen,2019-05-30 05:37:52,
145,"Ramirez-Herrera and Urrutia-Fucugauchi, 1999","Ramirez-Herrera, M.-T., and J. Urrutia-Fucugauchi, 1999, Morphotectonic zones along the coast of the Pacific continental margin, southern Mexico: Geomorphology, v. 28 (3-4), p. 237-250.",Geomorphology,1999,https://doi.org/10.1016/S0169-555X(99)00016-1,,144,EN,,Deirdre Ryan,Ann-Kathrin Petersen,2019-05-28 09:15:23,RSL indicators source
875,"Ramos and Tsutsumi, 2010","Ramos, N. T., and H. Tsutsumi, 2010, Evidence of large prehistoric offshore earthquakes deduced from uplifted Holocene marine terraces in Pangasinan Province, Luzon Island, Philippines: Tectonophysics, v. 495 (3-4), p. 145-158.",Tectonophysics,2010,https://doi.org/10.1016/j.tecto.2010.08.007,,164,EN,Holocene,Deirdre Ryan,Ann-Kathrin Petersen,2019-07-25 10:33:32,
877,"Ramos et al., 2012","Ramos, N. T., H. Tsutsumi, J. S. Perez, and P. P. Bermas, 2012, Uplifted marine terraces in Davao Oriental province, Mindanao Island, Philippines and their implications for large prehistoric offshores earthquakes along the Philippine trench: Journal of Asian Earth Sciences, v. 45 (2), p. 114-125.",Journal of Asian Earth Sciences,2012,https://doi.org/10.1016/j.jseaes.2011.07.028,,164,EN,Holocene,Deirdre Ryan,Ann-Kathrin Petersen,2019-07-25 10:38:41,
1948,"Rampton, 1988","Rampton, V. N., 1988. Quaternary Geology of the Tuktoyaktuk Coastlands, Northwest Territories. Geological Survey of Canada, Memoir 423, 1988, 98 p.","Geological Survey of Canada, Memoir",1988,,,33,EN,"Pleistocene,MIS 5",Evan Gowan,,2021-07-29 06:01:59,RSL indicators source
751,"Ramsay and Cooper, 2002","Ramsay, P. J., and J. A. G. Cooper, 2002, Late Quaternary Sea-Level Change in South Africa: Quaternary Research, v. 57 (1), p. 82-90.",Quaternary Research,2002,https://doi.org/10.1006/qres.2001.2290,,226,EN,"Holocene,Pleistocene,MIS 5",Deirdre Ryan,Ann-Kathrin Petersen,2019-07-23 08:52:13,
1321,Ramsay et al. 1993,"Ramsay, P. J., Smith. A. M., Lee-Thorp, J. C., Vogel, J. C., Tyldsley, M., and Kidwell,  W.  (1993).  130  000  year-old  fossil  elephant  found  near  Durban: Preliminary report. South African Journal of Science, 89, 165",,1993,,,,EN,,Andrew Cooper,Andrew Cooper,2020-04-07 08:43:33,
2019,"Ramsay, 1904","Ramsay, W., 1904. Beiträge zur Geologie der recenten und pleistocänen Bildungen der Halbinsel Kanin. Sällskapet för Finlands geografi.",Sällskapet för Finlands geografi,1904,,,176,Other,Pleistocene,Evan Gowan,,2021-09-15 10:01:19,RSL indicators source
1296,"Ramsay, 1994","Ramsay, P.J., 1994. Marine geology of the Sodwana Bay shelf, southeast Africa. Marine Geology, 120(3-4), pp.225-247.",Marine Geology,1994,,,,EN,,Andrew Cooper,,2020-04-02 10:58:47,
1189,"Rasul et al., 2018","Rasul, N. M. & Stewart, I. C. 2018. Geological Setting, Palaeoenvironment and Archaeology of the Red Sea, Springer.","Geological Setting, Palaeoenvironment and Archaeology of the Red Sea",2018,10.1007/978-3-319-99408-6,,178,EN,"Holocene,Pleistocene",Patrick Boyden,,2020-02-12 07:16:31,"RSL indicators source,Review"
