WALIS reference ID,Reference,Full reference,Journal,Year,doi,Link,Nation,Language,Timeframe,Record created by,Record updated by,Last Update,Type of paper
942,"Lecolle et al., 1990","Lecolle, J. F., J. E. Bokilo, and M. Bernat, 1990, Quaternary uplift and tectonism of the Ile d'Efate, New Hebrides (Vanuatu) island arc: dating of uplifted terraces by the U/Th method: Marine Geology, v. 94 (3), p. 251-270.",Marine Geology,1990,,,221,EN,"Holocene,Pleistocene",Deirdre Ryan,Ann-Kathrin Petersen,2019-07-27 06:17:43,
1896,"Lee and Park, 2018","Lee, G. R. and Park, C. S.: Study on Development and Distributional Characteristics of Terrace in the West and South Coast of Korea, Kyungpook National University and Korea Institute of Geoscience and Mineral Resources, unpublished, 1-111, 2018. (in Korean with English abstract)",Kyungpook National University and Korea Institute of Geoscience and Mineral Resources,2018,,,111,EN,Pleistocene,Alexander Simms,Alexander Simms,2021-06-07 17:44:23,RSL indicators source
1883,"Lee and Park, 2019a","Lee, G. R. and Park, C. S.: Production of Uplift Rate Map in the East Coast using Studies on Marine Terraces, Kyungpook National University and Korea Institute of Geoscience and Mineral Resources, unpublished, 1-106, 2019. (in Korean with English abstract)",Kyungpook National University and Korea Institute of Geoscience and Mineral Resources,2019,,,111,Other,Pleistocene,Alexander Simms,Alexander Simms,2021-06-07 17:45:42,RSL indicators source
1897,"Lee and Park, 2019b","Lee, G. R. and Park, C. S.: Comparison of uplift rate in the southern coast of the Korean Peninsula, Journal of the Korean Geomorphological Association, 26, 55-67, 2019. (in Korean with English abstract)",Journal of the Korean Geomorphological Association,2019,,,111,Other,Pleistocene,Alexander Simms,Alexander Simms,2021-06-07 17:46:50,RSL indicators source
1888,"Lee and Park, 2020","Lee, G. R. and Park, C. S.: Uplift rate map and distribution of uplift rate in the east coast of the Korean Peninsula, Journal of the Korean Geomorphological Association, 27, 47-60, 2020. (in Korean with English abstract)",Journal of the Korean Geomorphological Association,2020,,,111,Other,Pleistocene,Alexander Simms,Alexander Simms,2021-06-07 14:28:45,RSL indicators source
1885,"Lee et al., 2015","Lee, S. Y., Seong, Y. B., Kang, H. C., Choi, K. H., and Yu, B. Y.: Cosmogenic 10Be and OSL dating of marine terraces along the central-east coast of Korea: spatio-temporal variations in uplift rates, The Open Geography Journal, 7, 28-39, 2015.",The Open Geography Journal,2015,,,111,EN,Pleistocene,Alexander Simms,Alexander Simms,2021-06-03 00:07:41,RSL indicators source
552,"Leeder et al., 1991","Leeder, M. R., M. J. Seger, and C. P. Stark, 1991, Sedimentation and tectonic geomorphology adjacent to major active and inactive normal faults, southern Greece: Journal of the Geological Society, v. 148, p. 331-343.",Journal of the Geological Society,1991,https://doi.org/10.1144/gsjgs.148.2.0331,,83,EN,"Pleistocene,Pliocene",Deirdre Ryan,Ann-Kathrin Petersen,2019-07-20 13:27:04,
612,"Leeder et al., 2003","Leeder, M. R., L. C. McNeill, R. E. L. Collier, C. Portman, P. J. Rowe, J. E. Andrews, and R. L. Gawthorpe, 2003, Corinth rift margin uplift: New evidence from Late Quaternary marine shorelines: Geophysical Research Letters, v. 30, p. 1611-1614.",Geophysical Research Letters,2003, https://doi.org/10.1029/2003GL017382,,83,EN,"Holocene,Pleistocene",Deirdre Ryan,Ann-Kathrin Petersen,2019-07-22 11:08:49,
623,"Leeder et al., 2005","Leeder, M. R., C. Portman, J. E. Andrews, R. E. L. Collier, E. Finch, R. L. Gawthorpe, L. C. McNeill, M. Perez-Arlucea, and P. J. Rowe, 2005, Normal faulting and crustal deformation, Alkyonides Gulf and Perachora peninsula, eastern Gulf of Corinth rift, Greece: Journal of the Geological Society, v. 162, p. 549-561.",Journal of the Geological Society,2005, https://doi.org/10.1144/0016-764904-075,,83,EN,"Holocene,Pleistocene",Deirdre Ryan,Ann-Kathrin Petersen,2019-07-22 11:33:39,
506,"Lefort, 2011","Lefort, J. P., 2011, Deep structural control on distribution of raised beaches and Quaternary sedimentation in Brittany? A review: Quaternary International, v. 231 (1-2), p. 4-9.",Quaternary International,2011,https://doi.org/10.1016/j.quaint.2010.06.017,,69,EN,"Holocene,Pleistocene",Deirdre Ryan,Ann-Kathrin Petersen,2019-07-19 09:41:39,
707,"Lefèvre and Raynal, 2002","Lefèvre, D., and J.-P. Raynal, 2002, The plio-pleistocene formations of Casablanca and the marine Quaternary chronostratigraphy of Morocco revisited: Quaternaire, v. 13, p. 9-21.",Quaternaire,2002,,,126,,"Pleistocene,Pliocene",Deirdre Ryan,Ann-Kathrin Petersen,2019-07-23 06:29:07,
1831,"Lehman. and Forman, 1992","Lehman, S.J. and Forman, S.L., 1992. Late Weichselian glacier retreat in Kongsfjorden, west Spitsbergen, Svalbard. Quaternary Research, 37(2), pp.139-154.",Quaternary Research,1992,10.1016/0033-5894(92)90078-W,,186,EN,"Holocene,Pleistocene",Evan Gowan,,2021-03-25 10:34:20,RSL indicators source
185,"Leonard and Wehmiller, 1991","Leonard, E. M., and J. Wehmiller, 1991, Geochronology of marine terraces at Caleta Michilla, Northern Chile; implications for late Pleistocene and Holocene uplift: Revista Geologica de Chile, v. 18 (1), p. 81-86.",Revista Geologica de Chile,1991,http://dx.doi.org/10.5027/andgeoV18n1-a07 ,,41,,"Holocene,Pleistocene,MIS 5",Deirdre Ryan,Ann-Kathrin Petersen,2019-05-30 06:25:46,
202,"Leonard and Wehmiller, 2002","Leonard, E. M., and J. Wehmiller, 1992, Low uplift rates and terrace reoccupation inferred from mollusk aminostratigraphy, Coquimbo bay area, Chile: Quaternary Research, v. 38 (2), p. 246-259.",Quaternary Research,2002,https://doi.org/10.1016/0033-5894(92)90060-V,,41,EN,"Holocene,Pleistocene",Deirdre Ryan,Ann-Kathrin Petersen,2019-05-30 08:52:38,"RSL indicators source,Age techniques"
119,"Lettis and Hanson, 1992","Lettis, W. R., and K. L. Hanson, 1992, Quaternary tectonic influences on coastal morphology, south-central California: Quaternary International, v. 15-16, p. 135-148.",Quaternary International,1992,https://doi.org/10.1016/1040-6182(92)90042-Z,,230,EN,"Holocene,Pleistocene",Deirdre Ryan,Ann-Kathrin Petersen,2019-05-28 08:12:33,
1563,"Lidz et al., 1991","Lidz, B.H., Hine, A.C., Shinn, E.A., Kindinger, J.L., 1991. Multiple outer-reef tracts along the south Florida bank margin: outlier reefs, a new windward-margin model. Geology 19, 115–118.",Geology,1991,,,230,EN,,Jessica Creveling and Schmitty Thompson,,2020-09-25 22:48:25,
336,"Lidz et al., 2008","Lidz, B. H., E. A. Shinn, J. Harold Hudson, H. Gray Multer, R. B. Halley, and D. M. Robbin, 2008, Controls on Late Quaternary Coral Reefs of the Florida Keys, in B. M. Riegl, and R. E. Dodge, eds., Coral reefs of the USA: Berlin, Springer Science, p. 9-74.",Coral Reefs of the USA,2008,https://doi.org/10.1007/978-1-4020-6847-8_2,,230,EN,"Holocene,Pleistocene",Deirdre Ryan,Ann-Kathrin Petersen,2019-06-28 04:38:34,
319,"Lidz, 2004","Lidz, B. H., 2004, Coral reef complexes at an atypical windward platform margin : late Quaternary, southeast Florida: Geological Society of America Bulletin, v. 116 (7-8), p. 974-988.",Geological Society of America Bulletin,2004,https://doi.org/10.1130/B25172.1,,230,EN,"Holocene,Pleistocene",Deirdre Ryan,Ann-Kathrin Petersen,2019-06-27 09:06:10,
329,"Lidz, 2006","Lidz, B. H., 2006, Pleistocene corals of the Florida Keys: Architects of Imposing reefs - Why?: Journal of Coastal Research, v. 22 (4), p. 750-759.",Journal of Coastal Research,2006,https://doi.org/10.2112/06-0634.1,,230,EN,"Pleistocene,MIS 5",Deirdre Ryan,Ann-Kathrin Petersen,2019-06-28 04:25:41,
1849,"Liivrand, 1987","Liivrand, E., 1987. Regional type section of the Eemian marine deposits on Suur-Prangli. In Proceedings of the Academy of Sciences of the Estonian SSR, Geology (Vol. 36, No. 1, pp. 20-26).","Proceedings of the Academy of Sciences of the Estonian SSR, Geology",1987,,https://books.google.de/books?id=_6E0QgV_2rUC&lpg=PP1&hl=de&pg=PA20#v=onepage&q=75&f=false,58,Other,MIS 5,Evan Gowan,Evan Gowan,2021-04-07 15:40:18,RSL indicators source
1850,"Liivrand, 1991","Liivrand, E., 1991. Biostratigraphy of the Pleistocene deposits in Estonia and correlations in the Baltic region. Doctoral dissertation, Stockholm University, 114 pp.",Biostratigraphy of the Pleistocene deposits in Estonia and correlations in the Baltic region,1991,,http://su.diva-portal.org/smash/record.jsf?pid=diva2%3A1356707&dswid=-7754,58,EN,"Pleistocene,MIS 5",Evan Gowan,,2021-04-07 15:16:26,RSL indicators source
89,"Lindberg et al., 1980","Lindberg, D. R., B. Roth, M. G. Kellogg, and C. L. Hubbs, 1980, Invertebrate megafossils of Pleistocene (Sangamon Interglacial) age from Isla de Guadalupe, Baja California, Mexico: The California Islands: Proceedings of a multidisciplinary symposium, p. 41-62.",The California Islands: Proceedings of a multidisciplinary symposium,1980,,https://www.researchgate.net/profile/Barry_Roth2/publication/274639694_Invertebrate_megafossils_of_P,144,EN,"Pleistocene,MIS 5",Deirdre Ryan,Ann-Kathrin Petersen,2019-06-27 07:57:48,
1560,"Lindgren, 1889","Lindgren, W., 1889, Notes on the geology of Baja California, Mexico, Proceedings of the California Academy of Sciences, 1, 173-196.",Proceedings of the California Academy of Sciences,1889,,,230,EN,,Jessica Creveling and Schmitty Thompson,,2020-09-25 22:35:41,
1837,"Lindqvist et al., 2010","Lindqvist, C., Schuster, S.C., Sun, Y., Talbot, S.L., Qi, J., Ratan, A., Tomsho, L.P., Kasson, L., Zeyl, E., Aars, J. and Miller, W., 2010. Complete mitochondrial genome of a Pleistocene jawbone unveils the origin of polar bear. Proceedings of the National Academy of Sciences, 107(11), pp.5053-5057.",Proceedings of the National Academy of Sciences,2010,https://doi.org/10.1073/pnas.0914266107,,186,EN,"Pleistocene,MIS 5",Evan Gowan,,2021-03-30 09:49:48,RSL indicators source
1647,Lipparini 1936,"Lipparini T., 1936 - I fossili dei sedimenti marini nel sottosuolo
della bassa pianura Friulana. Bollettino Società Geologica Italiana,
55(1): 29-138.",Bollettino della Società Geologica Italiana,1936,,,,IT,Pleistocene,Alessandro Fontana,,2020-10-24 07:19:34,RSL indicators source
978,"Litchfield and Lian, 2004","Litchfield, N. J., and O. B. Lian, 2004, Luminescence age estimates of Pleistocene marine terrace and alluvial fan sediments associated with tectonic activity along coastal Otago, New Zealand: New Zealand Journal of Geology and Geophysics, v. 47 (1), p. 29-37.",New Zealand Journal of Geology and Geophysics,2004,https://doi.org/10.1080/00288306.2004.9515035,,158,EN,"Pleistocene,MIS 5",Deirdre Ryan,Alessio Rovere,2020-02-03 14:24:02,
1147,"Litt, 1990","Litt, T. (1990). Pollenanalytische Untersuchungen zur Vegetations- und Klimaentwicklung wahrend des Jungpleistozans in den Becken von Grobern und Grabschutz. Altenburger Naturwissenschaftliche Forschungen, 5, 92-105.",Altenburger Naturwissenschaftliche Forschungen,1990,,,51,Other,MIS 5,Kim Cohen,Kim Cohen,2020-08-09 08:34:06,Age techniques
1131,"Long et al., 2015","Long, A. J., Barlow, N. L. M., Busschers, F. S., Cohen, K. M., Gehrels, W. R., & Wake, L. M. (2015). Near-field sea-level variability in northwest Europe and ice sheet stability during the last interglacial. Quaternary Science Reviews, 126, 26-40.",Quaternary Science Reviews,2015,10.1016/j.quascirev.2015.08.021,https://www.sciencedirect.com/science/article/pii/S0277379115300883,"18,53,51,71,153,154",EN,MIS 5,Kim Cohen,Kim Cohen,2020-01-19 12:24:32,Review
418,"Lopez-Martinez et al., 1992","Lopez-Martinez, J., E. Martinez de Pison, and A. Arche, 1992, Geomorphology of Hurd Peninsula, Livingston Island, South Shetland Islands, in Y. Yoshida, ed., Recent Progress in Antarctic Earth Science: Tokyo, Terrapub, p. 751-756.",Recent Progress in Antarctic Earth Science: Tokyo.,1992,,,999,EN,,Deirdre Ryan,Ann-Kathrin Petersen,2019-07-02 08:48:19,
419,"Lopez-Martinez et al., 2006","Lopez-Martinez, J., R. Trouw, J. Galindo - Zaldivar, A. Maestro, L. Simoes, F. Medeiros, and C. Trouw, 2006, Tectonics and Geomorphology of Elephant Island, South Shetland Islands, in D. K. Futterer, D. Damaske, G. Kleinschmidt, H. Miller, and F. Tessensohn, eds., Antarctica : contributions to global earth sciences: Berlin, Heidelberg, New York, Springer - Verlag, p. 277-281.",Antarctica : contributions to global earth sciences: Springer - Verlag,2006,https://doi.org/10.1007/3-540-32934-X_34,https://link.springer.com/chapter/10.1007/3-540-32934-X_34,999,EN,"Holocene,Pleistocene",Deirdre Ryan,Ann-Kathrin Petersen,2019-07-02 08:51:49,
1161,"Lorie, 1906","Lorie, J. 1906 De Geologische Bouw der Gelderse Vallei, benevens Beschrijving van eenige nieuwe grondboringen. VII - Verh. Kon. Akad. Wetensch. 2-12-1: 1-100",Verh. Kon. Akad. Wetensch.,1906,,,153,Other,MIS 5,Kim Cohen,Kim Cohen,2020-01-19 13:30:19,RSL indicators source
1852,"Lorscheid and Rovere, 2019","Lorscheid, T. and Rovere, A., 2019. The indicative meaning calculator–quantification of paleo sea-level relationships by using global wave and tide datasets. Open Geospatial Data, Software and Standards, 4(1), pp.1-8.","Open Geospatial Data, Software and Standards",2019,"https://doi.org/10.1186/s40965-019-0069-8

",,,EN,,WALIS Admin,,2020-11-19 16:40:48,
1294,"Lorscheid et al., 2017","Lorscheid, T., Stocchi, P., Casella, E., Gómez-Pujol, L., Vacchi, M., Mann, T. and Rovere, A., 2017. Paleo sea-level changes and relative sea-level indicators: Precise measurements, indicative meaning and glacial isostatic adjustment perspectives from Mallorca (Western Mediterranean). Palaeogeography, Palaeoclimatology, Palaeoecology, 473, pp.94-107.","Palaeogeography,  Palaeoclimatolgy, Palaeoecolgy",2017,,,62,EN,Pleistocene,Alessio Rovere,Alessio Rovere,2020-04-01 07:31:20,RSL indicators source
1687,"Lorscheid et al., 2017b","Lorscheid, T., Felis, T., Stocchi, P., Obert, J.C., Scholz, D. and Rovere, A., 2017. Tides in the Last Interglacial: insights from notch geometry and palaeo tidal models in Bonaire, Netherland Antilles. Scientific Reports, 7(1), pp.1-9.",Scientific Reports,2017,https://doi.org/10.1038/s41598-017-16285-6,,8,EN,MIS 5,WALIS Admin,,2020-11-19 16:40:48,RSL indicators source
1773,"Loyer et al., 2005","Loyer, S., van Vliet-Lanoe, B., Monnier, J-L., Hallegouet, B. and Mercier, N. (1995). La coupe de Nantois (Baie de Saint-Brieuc, France) : Datations par thermoluminescence (TL) et données paléoenvironnementales nouvelles pour le Pléistocène de Bretagne. Quaternaire, 6(1), pp. 21-33",Quaternaire,1995,,,69,FR,MIS 5,Víctor Cartelle,,2021-02-12 20:23:46,
1522,"Lucchi et al., 2001","Lucchi, F., Tranne, C.A., Calanchi, N., Romagnoli, C., Pirazzoli, P., Radtke, U., Reyss, J.L., Rossi, P.L., 2001. Antiche linee di riva tardo-Quaternarie sull’sola di Lipari (Isole Eolie) e mobilità verticale dell’apparato vulcanico. Bollettino della Societ""a Geologica Italiana 120, pp. 165–187.",Bollettino della Società Geologica Italiana,2001,,,,IT,,Ciro Cerrone,,2020-08-16 13:37:16,
618,"Lucchi et al., 2004","Lucchi, F., C. A. Tranne, N. Calanchi, P. A. Pirazzoli, C. Romagnoli, U. Radtke, J. L. Reyss, and P. L. Rossi, 2004, Late-Quaternary ancient shorelines at Lipari (Aeolian Islands): stratigraphical constraints to reconstruct geological evolution and vertical movements: Quaternary International, v. 115-116, p. 105-115.",Quaternary International,2004,https://doi.org/10.1016/S1040-6182(03)00100-9,,100,EN,"Pleistocene,MIS 5",Deirdre Ryan,Ann-Kathrin Petersen,2019-07-22 11:24:54,
1514,"Lucchi et al., 2004b","Lucchi, F., Tranne, C.A., Calanchi, N., Rossi, P.L., 2004b. Late Quaternary fossil shorelines in the Aeolian Islands (Southern Tyrrhenian Sea): evaluation of long-term vertical displacements. Quaternaria Nova VIII, 49–62.",Quaternaria Nova,2004,,,,EN,,Ciro Cerrone,Ciro Cerrone,2020-08-12 19:38:16,
641,"Lucchi et al., 2007","Lucchi, F., C. A. Tranne, N. Calanchi, P. L. Rossi, and J. Keller, 2007, The stratigraphic role of marine deposits in the geological evolution of the Panarea volcano (Aeolian Islands, Italy): Journal of the Geological Society, v. 164, p. 989-996.",Journal of the Geological Society,2007,https://doi.org/10.1144/0016-76492006-135,,100,EN,"Pleistocene,MIS 5",Deirdre Ryan,Ann-Kathrin Petersen,2019-07-22 12:14:29,
661,"Lucchi, 2009","Lucchi, F., 2009, Late-Quaternary terraced marine deposits as tools for wide-scale correlation of unconformity-bounded units in the volcanic Aeolian archipelago (southern Italy): Sedimentary Geology, v. 216, p. 158-178.",Sedimentary Geology,2009,https://doi.org/10.1016/j.sedgeo.2009.03.003,,100,EN,"Holocene,Pleistocene,MIS 5,MIS 9",Deirdre Ryan,Ann-Kathrin Petersen,2019-07-22 13:18:19,
16,"Ludwig et al., 1991","Ludwig, K. R., B. J. Szabo, J. G. Moore, and K. R. Simmons, 1991, Crustal subsidence rate off Hawaii determined from 234 U/ 238 U ages of drowned coral reefs: Geology, v. 19 (2), p. 171-174.",Geology,1991, https://doi.org/10.1130/0091-7613(1991)019<0171:CSROHD>2.3.CO;2,,230,EN,Pleistocene,Deirdre Ryan,Ann-Kathrin Petersen,2019-05-24 11:54:05,
120,"Ludwig et al., 1992","Ludwig, K. R., D. R. Muhs, K. R. Simmons, and J. G. Moore, 1992, Sr-Isotope record of Quaternary marine terraces on the California coast and off Hawaii: Quaternary Research, v. 37 (3), p. 267-280.",Quaternary Research,1992,https://doi.org/10.1016/0033-5894(92)90066-R,,230,EN,Pleistocene,Deirdre Ryan,Ann-Kathrin Petersen,2019-05-28 08:14:08,Age techniques
281,"Ludwig et al., 1996","Ludwig, K. R., D. R. Muhs, K. R. Simmons, R. B. Halley, and E. A. Shinn, 1996, Sea-level records at ~ 80 ka from tectonically stable from stable platforms: Florida and Bermuda: Geology, v. 24 (3), p. 211-214.",Geology,1996,https://doi.org/10.1130/0091-7613(1996)024<0211:SLRAKF>2.3.CO;2,,"24,230",EN,"Pleistocene,MIS 5",Deirdre Ryan,Ann-Kathrin Petersen,2019-05-31 09:24:43,
1985,"Lukashov, 1982","Lukashov, A.D., 1982. Guidebook for excursions A-4, C-4, Karelia, International Union for Quaternary Research. In INQUA XI Congress, Moscow, USSR, 57p.",INQUA XI Congress,1982,,,176,EN,Pleistocene,Evan Gowan,,2021-07-30 04:57:37,RSL indicators source
1708,"Lundberg and Ford, 1994","LUNDBERG, J. & FORD, D. C. 1994. Late pleistocene sea level change in the Bahamas from mass spectrometric U-series dating of submerged speleothem. Quaternary Science Reviews, 13, 1-14.
",,1994,,,,EN,,Oana_Alexandra Dumitru,,2020-11-27 15:33:15,
1947,"Lunkka et al., 2016","Lunkka, J.P., Lintinen, P., Nenonen, K. and Huhta, P., 2016. Stratigraphy of the Koivusaarenneva exposure and its correlation across central Ostrobothnia, Finland. Bulletin of the Geological Society of Finland, 88(2).",Bulletin of the Geological Society of Finland,2016,10.17741/bgsf/88.2.001,,64,EN,"Pleistocene,MIS 5",Evan Gowan,,2021-07-29 05:52:38,
1950,"Lunkka et al., 2018","Lunkka, J.P., Kaparulina, E., Putkinen, N. and Saarnisto, M., 2018. Late Pleistocene palaeoenvironments and the last deglaciation on the Kola Peninsula, Russia. arktos, 4(1), pp.1-18.",arktos,2018,10.1007/s41063-018-0053-z,,176,EN,"Pleistocene,MIS 5",Evan Gowan,,2021-07-29 06:08:52,
1994,"Lunkka et al., 2019","Lunkka J. P., Sarala P. and Gibbard P. L.: Morphostratigraphy and its application to correlation of multiple till sequences in formerly glaciated terrains – an example from the eastern flank of the Scandinavian Ice Sheet. 3rd International Congress of Stratigraphy - Strati 2019, 2nd-9th July 2019 Milano. Abstracts p. 347, 2019.",3rd International Congress of Stratigraphy,2019,,http://www.strati2019.it/index.php,64,EN,MIS 5,Evan Gowan,,2021-07-30 07:14:50,RSL indicators source
1841,"Lycke et al., 1992","LYCKE, A.K., MANGERUD, J. and SEJRUP, H.P., 1992. Late Quaternary foraminiferal stratigraphy from western Svalbard. Boreas, 21(3), pp.271-288.",Boreas,1992,https://doi.org/10.1111/j.1502-3885.1992.tb00032.x,,186,EN,"Pleistocene,MIS 5",Evan Gowan,,2021-03-31 08:48:00,RSL indicators source
2002,"Löken, 1966","Löken, O.H., 1966. Baffin Island refugia older than 54,000 years. Science, 153(3742), pp.1378-1380.",Science,1966,10.1126/science.153.3742.1378,,33,EN,Pleistocene,Evan Gowan,,2021-08-02 06:01:59,RSL indicators source
1329,"MR Cooper, 1999","Cooper, M.R., 1999. The Cainozoic palaeontology and stratigraphy of KwaZulu-Natal. Part 3. The Mduku Formation. Stratigraphy and fauna. Durban Museum Novitates, 24(1), pp.48-56.",,1999,,,,EN,,Andrew Cooper,,2020-04-08 10:30:42,
190,"Machare and Ortlieb, 1992 ","Machare, J., and L. Ortlieb, 1992, Plio-Quaternary vertical motions and the subduction of the Nazca Ridge, central coast of Peru: Tectonophysics Andean Geodynamics, v. 205, p. 97-108.",Tectonophysics Andean Geodynamics,1992,https://doi.org/10.1016/0040-1951(92)90420-B,,161,EN,"Pleistocene,Pliocene",Deirdre Ryan,Ann-Kathrin Petersen,2019-05-30 06:37:54,
167,"Machare and Ortlieb, 1994","Machare, J., and L. Ortlieb, 1994, Morfoestratigrafia de los tablazos del noroeste peruano: neotectonica y fluctuaciones del nivel del mar: VIII Congreso Peruano de Geologia, p. 238-241.",,1994,,,161,ES,,Deirdre Ryan,Ann-Kathrin Petersen,2019-05-30 05:47:15,
1588,"Machida and Suzuki, 1971","町田洋 and 鈴木正男, 1971. 火山灰の絶対年代と第四紀.",,1971,,,103,Other,,Evan Tam,,2020-10-07 06:31:04,Age techniques
1628,"Machida et al., 1976","Machida, H., Nakagawa, H., Pirazzoli, P., 1976. PRELIMINARY STUDY ON THE HOLOCENE SEA LEVELS IN THE CENTRAL RYUKYU ISLANDS.",,1976,,,103,EN,,Evan Tam,,2020-10-11 02:37:37,Age techniques
1573,"Machida et al., 1987","MACHIDA, H., ARAI, F., MIYAUCHI, T. and OKUMURA, K., 1987. Toya ash-A widespread late Quaternary time-marker in northern Japan. The Quaternary Research (Daiyonki-kenkyu), 26(2), pp.129-145.",The Quaternary Research （第四紀研究）,1987,,https://www.jstage.jst.go.jp/article/jaqua1957/26/2/26_2_129/_pdf,103,Other,,Evan Tam,,2020-10-07 02:10:27,Age techniques
1599,"Machida, 1987","MACHIDA, H., 1987. Comments on the widespread tephras of Japan. The Quaternary Research (Daiyonki-Kenkyu), 25(4), pp.265-268.",The Quaternary Research （第四紀研究）,1987,,https://www.jstage.jst.go.jp/article/jaqua1957/25/4/25_4_265/_pdf,103,Other,,Evan Tam,,2020-10-08 01:45:00,Age techniques
1577,"Machida, 2002","Machida, H., 2002. Volcanoes and tephras in the Japan area. GLOBAL ENVIRONMENTAL RESEARCH-ENGLISH EDITION-, 6(2), pp.19-28.",Global Environmental Research,2002,,http://www.airies.or.jp/attach.php/6a6f75726e616c5f30362d32656e67/save/0/0/06_2-03.pdf,103,EN,,Evan Tam,,2020-10-07 04:00:17,Age techniques
1487,"Madsen et al., 1908","Madsen, V. C., Nordmann, V. J. H., & Hartz, N. E. K. (1908). Eem-zonerne: Studier over Cyprinaleret og andre Eem-aflejringer i Danmark, Nord-Tyskland og Holland. Danmarks Geologiske Undersoegelse, Series II, Vol. 17-19","Danmarks Geologiske Undersoegelse, Series II",1908,,,"53,51,153",Other,MIS 5,Kim Cohen,Kim Cohen,2020-08-03 14:04:56,"Review,Sea level indicator description"
860,"Maeda et al., 2004","Maeda, Y., F. Siringan, A. Omura, R. Berdin, Y. Hosono, S. Atsumi, and T. Nakamura, 2004, Higher-than-present Holocene mean sea levels in Ilocos, Palawan and Samar, Philippines: Quaternary International, v. 115-116, p. 15-26.",Quaternary International,2004,https://doi.org/10.1016/S1040-6182(03)00093-4,,164,EN,Holocene,Deirdre Ryan,Ann-Kathrin Petersen,2019-07-25 09:41:32,
1034,"Maejima et al., 2005","Maejima, Y., H. Matsuzaki, and T. Higashi, 2005, Application of cosmogenic 10Be to dating soils on the raised coral reef terraces of Kikai Island, southwest Japan: Geoderma, v. 126 (3-4), p. 389-399.",Geoderma,2005,https://doi.org/10.1016/j.geoderma.2004.10.004,,103,EN,Holocene,Deirdre Ryan,Ann-Kathrin Petersen,2019-07-27 10:08:51,
878,"Major et al., 2013","Major, J., Harris, R., Chiang, H-W., Cox, N., Shen, C-C., Nelson, S.T., Prasetyadi, C. and A. Rianto., 2013, Quaternary hinterland evolution of the active Banda Arc : Surface uplift and neotectonic deformation recorded by coral terraces at Kisar, Indonesia: Journal of Asian Earth Sciences, v. 73 (5), p.149-161. ",Journal of Asian Earth Sciences,2013,https://doi.org/10.1016/j.jseaes.2013.04.023,,93,EN,"Holocene,Pleistocene,MIS 5,MIS 7",Deirdre Ryan,Ann-Kathrin Petersen,2019-07-25 10:40:03,
1859,"Makowska et al., 2001","Makowska, A., Kabulski, P. and Uniejewska, M., 2001. The Tychnowy sea deposits from new boreholes against the structure of the Pleistocene complex in the Prabuty-Susz area, lower Vistula region. Biuletyn Panstwowego Instytutu Geologicznego, 398, pp.69-84.",Biuletyn Panstwowego Instytutu Geologicznego,2001,,,166,Other,MIS 5,Evan Gowan,,2021-05-12 14:33:17,RSL indicators source
1989,"Makowska, 1986","Makowska, A., 1986. Pleistocene seas in Poland—sediments, age and palaeogeography. Prace Instytutu Geologicznego, 120, pp.1-74.",Prace Instytutu Geologicznego,1986,,,166,Other,Pleistocene,Evan Gowan,,2021-07-30 05:57:41,RSL indicators source
1497,"Malatesta et al., 1957","Malatesta,  A., 1957.  Terreni, faune ed industrie quaternarie dell'arcipelago delle Egadi. Quaternaria, 4, pp.165- 257",Quaternaria,1957,,,100,IT,,Ciro Cerrone,,2020-08-05 09:54:42,
1510,"Malatesta, 1985","Malatesta, A., 1985. Geologia e paleobiologia dell'era glaciale. La Nuova Italia Scientifica, pp. 282.",La Nuova Italia Scientifica,1985,,,100,IT,,Ciro Cerrone,,2020-08-11 09:53:28,
337,"Mallinson et al., 2008","Mallinson, D., K. Burdette, S. Mahan, and G. Brook, 2008, Optically stimulated luminescence age controls on late Pleistocene and Holocene coastal lithosomes, North Carolina, USA: Quaternary Research, v. 69 (1), p. 97-109.",Quaternary Research,2008,https://doi.org/10.1016/j.yqres.2007.10.002,,230,EN,"Holocene,Pleistocene,MIS 3,MIS 5",Deirdre Ryan,Ann-Kathrin Petersen,2019-06-28 04:39:43,
