WALIS reference ID,Reference,Full reference,Journal,Year,doi,Link,Nation,Language,Timeframe,Record created by,Record updated by,Last Update,Type of paper
1548,"Dibble and Ehrenspeck, 1998","Dibblee Jr., T.W., Ehrenspeck, H.E.:, 1998, General geology of Santa Rosa Island, California. In: Contributions to the Geology of the Northern Channel Islands, Southern California, edited by: Weigand, P.W., Bakersfield, California, Pacific Section American","Contributions to the Geology of the Northern Channel Islands, Southern California",1998,,,,EN,,Jessica Creveling and Schmitty Thompson,,2020-09-25 22:11:20,
909,"Dickson et al., 1974","Dickson, M. E., C. A. Fleming, and T. L. Grant-Taylor. (1974). Ngarino terrace: an addition to the late Pleistocene standard sequence in the Wanganui-Taranaki district: New Zealand Journal of Geology and Geophysics, v. 17 (4), p. 789-798.",New Zealand Journal of Geology and Geophysics,1974,https://doi.org/10.1080/00288306.1974.10418226,,158,EN,"Pleistocene,MIS 5",Deirdre Ryan,Deirdre Ryan,2019-09-09 08:25:17,
1059,"Dietz, 1963","Dietz, R. S., 1963, Wave-base, marine profile of equilibrium, and wave-built terraces: a critical appraisal: Geological Society of America Bulletin, v. 74, p. 971-990.",Geological Society of America Bulletin,1963, https://doi.org/10.1130/0016-7606(1963)74[971:WMPOEA]2.0.CO;2,,999,EN,,Deirdre Ryan,Ann-Kathrin Petersen,2019-07-27 11:14:58,
2031,"Digerfeldt & Hendry, 1987","Digerfeldt, G. & Hendry, M.D. An 8000 year Holocene sea-level record from Jamaica: implications for interpretation of Caribbean reef and coastal history. Coral Reefs, 1987, 5:165-169",Coral Reefs,1987,https://doi.org/10.1007/BF00300959,,,EN,Holocene,John Doherty,,2021-10-05 14:29:06,
279,"Dionne and Occhietti, 1996","Dionne, J.-C., and S. Occhietti, 1996, Apercu du Quaternaire a l'embouchure du Saguenay, Quebec: Geographie physique et Quaternaire, v. 50 (1), p. 5-34.",Geographie physique et Quaternaire,1996,https://doi.org/10.7202/033072ar,,33,FR,Pleistocene,Deirdre Ryan,Ann-Kathrin Petersen,2019-05-31 09:22:19,
306,"Dionne, 2002","Dionne, J.-C., 2002, Etat des connaissances sur la ligne de rivage Micmac de J.W. Goldthwait (estuaire du Saint Laurent): Geographie physique et Quaternaire, v. 56 (1), p. 97-121.",Geographie physique et Quaternaire,2002,http://dx.doi.org/10.7202/008607ar,,33,FR,"Holocene,Pleistocene",Deirdre Ryan,Ann-Kathrin Petersen,2019-06-27 08:45:11,
745,"Diouf et al., 1995","Diouf, B., P. Giresse, S. Occhietti, C. Causse, and P. Pichet, 1995, A petrological and geochemical study of the calcareous sandstone of West African marine Pleistocene (Cap des Biches, Senegal): Quaternary International, v. 29-30, p. 49-60.",Quaternary International,1995,https://doi.org/10.1016/1040-6182(95)00007-6,,190,EN,"Pleistocene,MIS 5",Deirdre Ryan,Ann-Kathrin Petersen,2019-07-23 08:35:54,
1050,"Dobrodeev, 1969","Dobrodeev, O. P., 1969, Paléogéographie du Pléistocène du sud de la Plaine russe : Quaternaire, v. 6, p. 75-86.",Quaternaire ,1969,https://doi.org/10.3406/quate.1969.1124,www.persee.fr/doc/quate_0004-5500_1969_num_6_1_1124,176,FR,"Pleistocene,Pliocene",Deirdre Ryan,Ann-Kathrin Petersen,2019-07-27 10:53:12,
255,"Dodge et al., 1983","Dodge, R. E., R. G. Fairbanks, L. K. Benninger, and F. Maurrasse, 1983, Pleistocene Sea Levels from Raised Coral Reefs of Haiti: Science, v. 219 (4591), p. 1423-1425.",Science,1983,https://doi.org/10.1126/science.219.4591.1423,,91,EN,"Pleistocene,MIS 5",Deirdre Ryan,Ann-Kathrin Petersen,2019-05-31 08:41:18,
647,"Dodonov et al., 2008","Dodonov, A. E., V. G. Trifonov, T. P. Ivanova, V. Y. Kuznetsov, F. E. Maksimov, D. M. Bachmanov, T. A. Sadchikova, A. N. Simakova, H. Minini, A.-M. Al-Kafri, and O. Ali, 2008, Late Quaternary marine terraces in the Mediterranean coastal area of Syria: Geochronology and neotectonics: Quaternary International, v. 190, p. 158-170.",Quaternary International,2008,https://doi.org/10.1016/j.quaint.2008.02.008,,195,EN,"Pleistocene,MIS 5",Deirdre Ryan,Ann-Kathrin Petersen,2019-07-22 12:27:23,
179,"Dollfus et al., 1970","Dollfus, O., P. Gabert, P.,and R. Laharie, 1970, Les problèmes morphologiques du piémont désertique des Andes péruviennes méridionales: Revue de Géographie Alpine, v. 58 (2), p. 265-300.",Revue de Géographie Alpine,1970,,https://www.persee.fr/doc/rga_0035-1121_1970_num_58_2_3472?pageid=t1_284,161,FR,,Deirdre Ryan,Ann-Kathrin Petersen,2019-07-31 10:48:51,
2078,"Dominguez and Wanless, 1991","Dominguez, J.M.L., Wanless, H.R., (1991) 'Facies architecture of a falling sea-level strandplain, Doce River coast, Brasil'. ","In: International Association of Sedimentologists, Special Publications 14: 259–281.",1991,,https://pascal-francis.inist.fr/vibad/index.php?action=getRecordDetail&idt=6372935,27,EN,,"Muhammad Abdullah Saeed, Khan",,2021-10-14 13:25:15,
1211,"Dominguez et al., 1990","Dominguez, J.M.L., A.C.S.P. Bittencourt, Z.M.D.A.N. Leão and A.E.G.D. Azevedo, 1990, Geologia do Quaternário costeiro do estado de Pernambuco. ",Revista Brasileira de Geociências,1990,,https://pdfs.semanticscholar.org/82fc/b28be1d607f1c6d8e2d9d789296f98072352.pdf,27,Other,"Holocene,Pleistocene",Karla Zurisadai Rubio Sandoval ,,2020-03-03 03:31:15,Sea level indicator description
2076,"Dominguez et al., 1992","Dominguez, J.M.L., Bittencourt, A.C.S.P. and Martin, L.,  (1992) 'Controls on Quaternary coastal evolution of the east-north- eastern coast of Brazil: roles of sea-level history, trade winds and climate'. ","In: J.F. Donoghue, R.A. Davis, C.H. Fletcher and J.R. Suter (Editors), Quaternary Coastal Evolution. Sediment. Geol., 80: 213-232.",1992,10.1016/0037-0738(92)90042-P,https://www.sciencedirect.com/science/article/pii/003707389290042P,27,EN,"Holocene,Pleistocene","Muhammad Abdullah Saeed, Khan",,2021-10-14 12:31:44,
1332,"Donoghue, J.F. and Tanner, W.F.","Donoghue, J.F. and Tanner, W.F. (1992).  'Quaternary Terraces and Shorelines of the Panhandle Florida Region.'  Fletcher, C.W. III and Wehmiller, J.F. (eds.), Quaternary Coasts of the United States: Marine and Lacustrine Systems, SEPM Special Publication 48, p. 233-241.",SEPM Special Publication 48,1992,doi.org/10.2110/pec.92.48.0233,https://pubs.geoscienceworld.org/books/book/1100/chapter/10550288/Quaternary-Terraces-and-Shorelines,,EN,MIS 5,Alexander Simms,,2020-04-08 16:26:05,RSL indicators source
1240,"Dorale et al., 2010","Dorale, J.A., Onac, B.P., Fornós, J.J., Ginés, J., Ginés, A., Tuccimei, P. and Peate, D.W., 2010. Sea-level highstand 81,000 years ago in Mallorca. Science, 327(5967), pp.860-863.",Science,2010,10.1126/science.1181725,,62,EN,,WALIS Admin,,2020-03-14 17:32:45,
439,"Downie and Singh, 1969","Downie, C., and G. Singh, 1969, Dinoflagellate Cysts from Estuarine and Raised Beach Deposits at Woodgrange, Co. Down, N. Ireland: Grana Palynologica, v. 9 (1-3), p. 124-132.",Grana Palynologica,1969,https://doi.org/10.1080/00173136909436430,,71,EN,,Deirdre Ryan,Ann-Kathrin Petersen,2019-07-17 08:52:43,
1757,"Dredge et al., 1992","Dredge, L.A., Mott, R.J. and Grant, D.R., 1992. Quaternary stratigraphy, paleoecology, and glacial geology, Îles de la Madeleine, Quebec. Canadian Journal of Earth Sciences, 29(9), pp.1981-1996.",Canadian Journal of Earth Sciences,1992,10.1139/e92-154,,33,EN,MIS 5,Evan Gowan,,2021-02-01 17:15:34,RSL indicators source
556,"Dubar et al., 1992","Dubar, M., Y. Guglielmi, and C. Falgueres, 1992, Néotectonique et sédimentation côtière quaternaires en bordure de l'arc subalpin de Nice (A.M., France): Quaternaire, v. 3, p. 105-110.",Quaternaire,1992,https://doi.org/10.3406/quate.1992.1979,,69,FR,"Holocene,Pleistocene",Deirdre Ryan,Ann-Kathrin Petersen,2019-07-20 13:39:31,
648,"Dubar et al., 2008","Dubar, M., C. Innocent, and O. Sivan, 2008, Radiometric dating (U/Th) of the lower marine terrace (MIS 5.5) west of Nice (French Riviera): Morphological and neotectonic quantitative implications: Comptes Rendus Geosciences, v. 340, p. 723-731.",Comptes Rendus Geosciences,2008,https://doi.org/10.1016/j.crte.2008.07.012,,69,EN,"Pleistocene,MIS 5",Deirdre Ryan,Ann-Kathrin Petersen,2019-07-22 12:29:52,
910,"Dubois et al., 1973","Dubois, J., J. Launay, and J. Recy, 1973, Emersion de traces de niveaux marins quaternaires dans la région Nouvelle-Calédonie - Iles Loyauté et tentative d'explication du phénomène par un bombement de la lithosphère: Le quaternaire : géodynamique, stratigraphie et environnement, v. 9, p. 163-167.","Le quaternaire : géodynamique, stratigraphie et environnement",1973,,http://www.documentation.ird.fr/hor/fdi:06978,148,FR,"Holocene,Pleistocene",Deirdre Ryan,Ann-Kathrin Petersen,2019-07-26 11:15:12,
1727,"Ducloz, 1968","Ducloz, C., 1968, Les formations Quaternaires de la region de Klepini (Chypre) et leur place dans la chronologie du Quaternaire Mediterraneen, published by: Societe de Physique et d’Histoire Naturelle de Geneve, Geneva, Switzerland, Archives des Sciences, vol. 20, no. 2, pp. 123-198","Archives des Sciences, Societe de Physique et d’Histoire Naturelle de Geneve ",1968,,,49,FR,Pleistocene,Zomenia Zomeni,,2020-12-29 10:14:19,RSL indicators source
522,"Dufaure, 1970","Dufaure, J. J., 1970, Niveaux d'abrasion marine quaternaires autour du Péloponèse: Annales de Géographie, v. 433, p. 325-342.",Annales de Géographie,1970,https://doi.org/10.3406/geo.1970.15126,,83,FR,"Holocene,Pleistocene,Pliocene",Deirdre Ryan,Ann-Kathrin Petersen,2019-07-19 10:56:46,
1693,Dumas 1987,"Dumas, B., Gueremy, P., Lhenaff, R., Raffy, J., 1987b. Rates of uplift as shown by raised Quaternary shorelines in Southern Calabria (Italy). Zeitschrift fu¨ r Geomorphologie N.F. Suppl. Bd. 63, 119– 132",Zeitschrift fu¨ r Geomorphologie N.F. Suppl. Bd,1987,,,,EN,,Ciro Cerrone,Ciro Cerrone,2020-11-22 21:21:54,
565,"Dumas and Raffy, 1996","Dumas, B., and J. Raffy, 1996, Geomorphological record of glacio-eustatic peaks in the uplifted Soverato area (southern Italy): Bulletin de la Société Géologique de France, v. 167, p. 285-293.",Bulletin de la Société Géologique de France,1996,,,100,EN,,Deirdre Ryan,Ann-Kathrin Petersen,2019-07-20 14:04:04,
544,"Dumas et al., 1988","Dumas, B., P. Gueremy, P. J. Hearty, R. Lhenaff, and J. Raffy, 1988, Morphometric analysis and amino acid geochronology of uplifted shorelines in a tectonic region near Reggio Calabria, South Italy: Palaeogeography, Palaeoclimatology, Palaeoecology, v. 68, p. 273-289.","Palaeogeography, Palaeoclimatology, Palaeoecology",1988,https://doi.org/10.1016/0031-0182(88)90045-4,,100,EN,"Pleistocene,MIS 5",Deirdre Ryan,Ann-Kathrin Petersen,2019-07-20 13:10:43,
1739,"Dumas et al., 1991","Dumas, B., Guérémy, P., Hoang, C.-T., Lhdnaff, R. and Raffy,
J., 1991. Gisement et rivages tyrrhéniens de Vibo Marina
(Italie du Sud): datation 230Th/234U, soulévement de la
Calabre méridionale. C. R. Acad. Sci. Paris, 312, SGr. 2,
pp. 785-791.",,1991,,,,FR,,Ciro Cerrone,,2021-01-18 23:02:48,
588,"Dumas et al., 1999","Dumas, B., P. Guérémy, and J. Raffy, 1999, Essai de corrélation entre des étagements de lignes de rivage soulevées en Calabre méridionale (Italie) et des courbes isotopiques à haute résolution entre 130 et 40 ka: Quaternaire, v. 10, p. 107-119.",Quaternaire,1999,https://doi.org/10.3406/quate.1999.1635,,100,FR,"Pleistocene,MIS 5",Deirdre Ryan,Ann-Kathrin Petersen,2019-07-22 10:15:09,
593,"Dumas et al., 2000","Dumas, B., P. Guérémy, R. Lhénaff, and J. Raffy, 2000, Périodicités de temps long et de temps court, depuis 400 000 ans, dans l'étagement des terrasses marines en Calabre méridionale (Italie) / Long and short timing from 400000 years in the stepped marine terraces in Southern Calabria (Italy): Géomorphologie: relief, processus, environnement, v. 6, p. 25-44.","Géomorphologie: relief, processus, environnement",2000,https://doi.org/10.3406/morfo.2000.1041,,100,FR,"Holocene,Pleistocene,MIS 5,MIS 7,MIS 9,MIS 11",Deirdre Ryan,Ann-Kathrin Petersen,2019-07-22 10:28:31,
622,"Dumas et al., 2005","Dumas, B., P. Guérémy, and J. Raffy, 2005, Evidence for sea-level oscillations by the ""characteristic thickness"" of marine deposits from raised terraces of Southern Calabria (Italy): Quaternary Science Reviews Quaternary coastal morphology and sea-level changes, v. 24, p. 2120-2136.",Quaternary Science Reviews,2005,https://doi.org/10.1016/j.quascirev.2004.12.011,,100,EN,"Pleistocene,MIS 3,MIS 5",Deirdre Ryan,Ann-Kathrin Petersen,2019-07-22 11:31:45,
327,"Dumas et al., 2006","Dumas, B., C. T. Hoang, and J. Raffy, 2006, Record of MIS 5 sea-level highstands based on U/Th dated coral terraces of Haiti: Quaternary International, v. 145-146, p. 106-118.",Quaternary International,2006,https://doi.org/10.1016/j.quaint.2005.07.010,,91,EN,"Pleistocene,MIS 5",Deirdre Ryan,Ann-Kathrin Petersen,2019-06-28 04:22:31,
530,"Dumas, 1977","Dumas, B., 1977, Succession et âges radiométriques des terrasses marines du levant espagnol: Bulletin de l'Association Francaise pour l'Etude du Quaternaire, v. 14, p. 82-85.",Bulletin de l'Association Francaise pour l'Etude du Quaternaire,1977,https://doi.org/10.3406/quate.1977.1321,,62,FR,,Deirdre Ryan,Ann-Kathrin Petersen,2019-07-19 11:17:11,
546,"Dumas, 1989","Dumas, B., 1989, Ligne de rivage de Calabre (Italie) et terrasses coralliennes soulevées : essai de corrélation: Bulletin du Centre de Géomorphologie du CNRS, Caen, v. 36, p. 243-246.",Bulletin du Centre de Géomorphologie du CNRS,1989,,,100,FR,,Deirdre Ryan,Ann-Kathrin Petersen,2019-07-20 13:13:11,
1246,"Dumitru et al., 2021","Dumitru, O.A., Polyak, V.J., Asmerom, Y. and Onac, B.P., 2021. Last interglacial sea-level history from speleothems: a global standardized database. Earth System Science Data, 13(5), pp.2077-2094.",Earth System Science Data,2021,https://doi.org/10.5194/essd-13-2077-2021,,,EN,Pleistocene,WALIS Admin,WALIS Admin,2021-06-14 12:12:33,Review
206,"Dumont et al., 2005","Dumont, J. F., E. Santana, W. Vilema, K. Pedoja, M. Ord??ez, M. Cruz, N. Jimenez, and I. Zambrano, 2005, Morphological and microtectonic analysis of Quaternary deformation from Puna and Santa Clara Islands, Gulf of Guayaquil, Ecuador (South America): Tectonophysics Andean Geodynamics, v. 399 (1-4), p. 331-350.",Tectonophysics Andean Geodynamics,2005,https://doi.org/10.1016/j.tecto.2004.12.029,,57,EN,"Pleistocene,MIS 11",Deirdre Ryan,Ann-Kathrin Petersen,2019-05-30 09:30:36,
427,"Dunlop, 1893","Dunlop, A., 1893, On Raised Beaches and Rolled Stones at High Levels in Jersey: Quarterly Journal of the Geological Society, v. 49 (1-4), p. 523-530.",Quarterly Journal of the Geological Society,1893,https://doi.org/10.1144/GSL.JGS.1893.049.01-04.61,,71,EN,,Deirdre Ryan,Ann-Kathrin Petersen,2019-07-02 09:19:27,
100,"Dupre, 1984","Dupre, W. R., 1984, Reconstruction of paleo-wave conditions during the late pleistocene from marine terrace deposits, Monterey Bay, California: Marine Geology, v. 60 (1-4), p. 435-454.",Marine Geology,1984,https://doi.org/10.1016/S0070-4571(08)70158-4,,230,EN,"Pleistocene,MIS 5",Deirdre Ryan,Ann-Kathrin Petersen,2019-05-28 05:42:52,
656,"Dutton et al., 2009","Dutton, A., G. Scicchitano, C. Monaco, J. M. Desmarchelier, F. Antonioli, K. Lambeck, T. M. Esat, L. K. Fifield, M. T. McCulloch, and G. Mortimer, 2009, Uplift rates defined by U-series and 14C ages of serpulid-encrusted speleothems from submerged caves near Siracusa, Sicily (Italy): Quaternary Geochronology, v. 4, p. 2-10.",Quaternary Geochronology,2009,https://doi.org/10.1016/j.quageo.2008.06.003,,100,EN,"Holocene,Pleistocene,MIS 5",Deirdre Ryan,Ann-Kathrin Petersen,2019-07-22 13:04:20,
1307,"Dutton et al., 2015","Dutton, A., Webster J. M., Zwartz, D., Lambeck, K., & Wohlfarth, B. 2015. Tropical tales of polar ice: evidence of Last Interglacial polar ice sheet retreat recorded by fossil reefs of the granitic Seychelles Islands. Quaternary Science Reviews, 107, 182-196.",Quaternary Science Reviews,2015,http://dx.doi.org/10.1016/j.quascirev.2014.10.025,,180,EN,MIS 5,Peter Chutcharavan,,2020-04-05 22:40:01,RSL indicators source
2051,"Ebanks, 1967","Ebanks, William J. Jr. Recent carbonate sedimentation and diagenesis, Ambergris Cay, British Honduras. Rice University PhD Thesis, 1967.",,1967,,https://www.proquest.com/openview/43c6c507fb26900d6b761191c07f2c25/1.pdf?pq-origsite=gscholar&cbl=18,,EN,Holocene,John Doherty,,,
868,"Edinger et al., 2007","Edinger, E. N., G. S. Burr, J. M. Pandolfi, and J. C. Ortiz, 2007, Age accuracy and resolution of Quaternary corals used as proxies for sea level: Earth and Planetary Science Letters, v. 253 (1-2), p. 37-49.",Earth and Planetary Science Letters,2007,https://doi.org/10.1016/j.epsl.2006.10.014,,163,EN,Holocene,Deirdre Ryan,Ann-Kathrin Petersen,2019-07-25 10:07:57,
259,"Edwards et al., 1987","Edwards R.L. Chen J.H. Ku T.L. and Wasserburg G.J. 1987. Precise timing of the last interglacial period from mass spectrometric determination of thorium-230 in corals. Science, v. 236 (4808), p.1547-1553.",Science,1987,https://doi.org/10.1126/science.236.4808.1547,,999,EN,Pleistocene,Deirdre Ryan,Ann-Kathrin Petersen,2019-05-31 08:46:55,Age techniques
828,"Edwards et al., 1993","Edwards R.L. Beck J.W. Burr G.S. Donahue D.J. Chappell J.M.A. Bloom A.L. Druffel E.R.M. Taylor F.W., 1993: A large drop in atmospheric 14C/12C and reduced melting in the Younger Dryas documented with 230Th ages of corals. Science, v. 260 (5110), p. 962-967.",Science,1993,DOI: 10.1126/science.260.5110.962,,163,EN,"Holocene,Pleistocene",Deirdre Ryan,Ann-Kathrin Petersen,2019-07-25 08:27:54,
282,"Edwards et al., 1997","Edwards R.L., Cheng H., Murrell M.T. and Goldstein S.J., 1997, Protactinium-231 dating of carbonates by thermal ionization mass spectrometry: implications for Quaternary climate change: Science, v. 276 (5313), p.782-786.",Science,1997,DOI: 10.1126/science.276.5313.782,,999,EN,"Holocene,Pleistocene",Deirdre Ryan,Ann-Kathrin Petersen,2019-05-31 09:26:13,Age techniques
1369,Edwards et al; 1987 EPSL,"R. Lawrence Edwards, J.H. Chen, G.J. Wasserburg 1987 - 238U234U230Th232Th systematics and the precise measurement of time over the past 500,000 years. Earth and Planetary Science Letters, Volume 81, Issues 2–3, January 1987, Pages 175-192
",Earth and Planetary Science Letters,1987,https://doi.org/10.1016/0012-821X(87)90154-3,,"16,55,221",EN,"Pleistocene,MIS 5",Gilbert Camoin,,2020-05-05 05:31:11,Age techniques
956,"Eisenhauer et al., 1993","Eisenhauer A., Wasserburg G.J., Chen J.H., Bonani G., Collins L.B., Zhu Z.R. and Wyrwoll K.H. 1993. Holocene sea-level determination relative to the Australian continent: U/Th TIMS and 14C (AMS) dating of corals from the Abrolhos Islands: Earth and Planetary Science Letters, v. 114 (4), p. 529-547.",Earth and Planetary Science Letters,1993,https://doi.org/10.1016/0012-821X(93)90081-J,,12,EN,Holocene,Deirdre Ryan,Ann-Kathrin Petersen,2019-07-27 06:41:25,
962,"Eisenhauer et al., 1996","Eisenhauer A., Zhu Z.R., Collins L.B., Wyrwoll K.H. and Eichstätter R., 1996, The Last Interglacial sea level change: new evidence from the Abrolhos islands West Australia: Geologische Rundschau, v. 85(3), pp.606-614.",Geologische Rundschau,1996,https://doi.org/10.1007/BF02369014,,12,EN,"Holocene,Pleistocene,MIS 5",Deirdre Ryan,Ann-Kathrin Petersen,2019-07-27 06:54:07,
1215,"El Abdellaoui et al., 2016","Jamal Eddine El Abdellaoui, François Petitb, Bassam Ghalebc, André Ozerb, 2016. Sea-level fluctuation during MIS 5e and geomorphological context on the southern coast of the Strait of Gibraltar (Morocco). Gèomorphologie: relief, processus, environnment",,2016,,10.4000/geomorphologie.11467,,EN,MIS 5,Ciro Cerrone,,2020-03-05 02:43:18,
531,"El Gharbaoui, 1977","El Gharbaoui, A., 1977, Note preliminaire sur l'evolution geomorphologique de la peninsule de Tanger: Bulletin de la Société Géologique de France, v. 7, p. 615-622.",Bulletin de la Société Géologique de France,1977, https://doi.org/10.2113/gssgfbull.S7-XIX.3.615,,126,FR,"Pleistocene,Pliocene",Deirdre Ryan,Ann-Kathrin Petersen,2019-07-19 11:21:34,
672,"El Kadiri et al., 2010","El Kadiri, K., C. Sanz de Galdeano, A. Pedrera, A. Chalouan, J. Galindo - Zaldivar, R. Julia, M. Akil, R. Hlila, and M. Ahmamou, 2010, Eustatic and tectonic controls on Quaternary Ras Leona marine terraces (Strait of Gibraltar, northern Morocco): Quaternary Research, v. 74, p. 277-288.",Quaternary Research,2010,https://doi.org/10.1016/j.yqres.2010.06.008,,126,EN,"Holocene,Pleistocene",Deirdre Ryan,Ann-Kathrin Petersen,2019-07-23 04:56:41,
782,"El Moursi et al., 1994","El Moursi, M., C. T. Hoang, I. F. E. Fayoumy, O. Hegab, and H. Faure, 1994, Pleistocene evolution of the Red Sea coastal plain, Egypt: Evidence from uranium-series dating of emerged reef terraces: Quaternary Science Reviews, v. 13 (4), p. 345-359.",Quaternary Science Reviews,1994,https://doi.org/10.1016/0277-3791(94)90112-0,,59,EN,"Pleistocene,MIS 5,MIS 7,MIS 9",Deirdre Ryan,Ann-Kathrin Petersen,2019-07-23 14:32:49,
1672,El-Asmar 1994,"El-Asmar, H.M., 1994. Aeolianite sedimentation along the northwestern coast of Egypt: Evidence for middle to late Quaternary aridity.",,1994,,,,EN,,Barbara Mauz,,2020-11-10 18:07:01,
1671,El-Asmar and Wood 2000,"El-Asmar, H.M. and Wood, P. 2000. Quaternary shoreline development: the northwestern coast of Egypt. Quaternary Science Reviews 19, 1137-1149.",,2000,,,,EN,,Barbara Mauz,,2020-11-10 18:06:14,
787,"El-Asmar, 1997","El-Asmar, H. M., 1997, Quaternary isotope stratigraphy and paleoclimate of coral reef terraces, Gulf of Aqaba, South Sinai, Egypt: Quaternary Science Reviews, v. 16 (8), p. 911-924.",Quaternary Science Reviews,1997,https://doi.org/10.1016/S0277-3791(96)00077-7,,59,EN,"Holocene,Pleistocene,MIS 5,MIS 7,MIS 9,MIS 11",Deirdre Ryan,Ann-Kathrin Petersen,2019-07-23 14:40:38,
744,"El-Gharbaoui et al., 1994","El-Gharbaoui, A., A. Choukri, M. Berrada, H. Falaki, and J.-L. Reyss, 1994, Datation de deux niveaux marins sur la côte du Haut Atlas atlantique à 275 000 ans et à 120 000 ans: Cahiers de géographie du Québec, v. 38 (104), p. 241-247.",Cahiers de géographie du Québec,1994,10.7202/022449ar,https://core.ac.uk/download/pdf/59288505.pdf,126,FR,Pleistocene,Deirdre Ryan,Ann-Kathrin Petersen,2019-07-23 08:34:24,
434,"Elhai, 1960","Elhai, H. 1960, La Tourbière de Gathémo, Manche, Normandie. Ed. du Museum.",Ed. du Museum,1960,,https://www.worldcat.org/title/tourbiere-de-gathemo-manche-normandie/oclc/799343943,69,FR,,Deirdre Ryan,Ann-Kathrin Petersen,2019-07-28 05:50:39,
1555,"Ellis, 1919","Ellis, A. J.: Physiography, in Geology and ground waters of the western part of San Diego County, California: U.S. Geol. Survey Water-Supply Paper 446, 20-50, 1919.",U.S. Geol. Survey Water-Supply Paper,1919,,,230,EN,,Jessica Creveling and Schmitty Thompson,,2020-09-25 22:25:20,
657,"Elmejdoub and Jedoui, 2009","Elmejdoub, N., and Y. Jedoui, 2009, Pleistocene raised marine deposits of the Cap Bon peninsula (N-E Tunisia): Records of sea-level highstands, climatic changes and coastal uplift: Geomorphology, v. 112, p. 179-189.",Geomorphology,2009,https://doi.org/10.1016/j.geomorph.2009.06.001,,205,EN,"Pleistocene,MIS 5,MIS 7,MIS 9,MIS 11",Deirdre Ryan,Ann-Kathrin Petersen,2019-07-22 13:06:48,
1673,Elshazly et al. 2019,"Elshazly, A., El-Sayed, M., Pascucci, V., 2019. A sedimentary depositional and diagenetic model of a Pleistocene/Holocene coatsal formation in Alexandria, Mediterranean Sea, Egypt. Journal of African Earth Sciences 158, 103552.",,2019,10.1016/j.jafrearsci.2019.103552,,,EN,,Barbara Mauz,,2020-11-10 18:21:04,
876,"Ely et al., 2011","Ely, K. S., M. Sandiford, M. L. Hawke, D. Phillips, M. Quigley, and J. E. dos Reis, 2011, Evolution of Atauro Island : Temporal constraint on subduction processes beneath the Wetar zone, Banda Arc: Journal of Asian Earth Sciences, v. 41 (6), p. 477-493.",Journal of Asian Earth Sciences,2011,https://doi.org/10.1016/j.jseaes.2011.01.019,,999,EN,"Pleistocene,Pliocene",Deirdre Ryan,Ann-Kathrin Petersen,2019-07-25 10:37:20,
58,"Emerson et al., 1981","Emerson, W. K., G. L. Kennedy, J. Wehmiller, and E. Keenan, 1981, Age relations and zoogeographic implications of Late Pleistocene marine invertebrate faunas from Turtle Bay, Baja California Sur, Mexico: The Nautilus, v. 95, p. 105-115.",The Nautilus,1981,,,144,EN,Pleistocene,Deirdre Ryan,Ann-Kathrin Petersen,2019-07-31 09:29:47,
68,"Emery, 1958","Emery, K. O., 1958, Shallow submerged marine terraces of Southern California: Bulletin of the Geological Society of America, v. 69, p. 39-60.",Bulletin of the Geological Society of America,1958, https://doi.org/10.1130/0016-7606(1958)69[39:SSMTOS]2.0.CO;2,,230,EN,Pleistocene,Deirdre Ryan,Ann-Kathrin Petersen,2019-05-27 12:00:28,
251,"Emery, 1981","Emery, K. O., 1981, Low marine terraces of Grand Cayman Island: Estuarine, Coastal and Shelf Science, v. 12 (5), p. 569-578.","Estuarine, Coastal and Shelf Science",1981,https://doi.org/10.1016/S0302-3524(81)80083-7,,113,EN,"Pleistocene,MIS 5",Deirdre Ryan,Ann-Kathrin Petersen,2019-05-31 08:34:33,
1819,Engelhart and Horton,"Engelhart, S.E., Horton, B.P. (2012) Holocene sea level database for the Atlantic coast of the United States, Quaternary Science Reviews, Volume 54, Pages 12-25,",Quaternary Science Reviews,2012,https://doi.org/10.1016/j.quascirev.2011.09.013,,,EN,,Natasha Barlow,,2021-03-18 17:22:37,
1528,Erginal et a. 2017,"Ahmet Evren Erginal, Nafiye Güneç Kıyak, Hamit Haluk Selim, Mustafa Bozcu, Muhammed Zeynel Öztürk, Yunus Levent Ekinci, Alper Demirci, Elmas Kırcı Elmas, Tug˘ba Öztürk, Çag˘lar Çakır, Mustafa Karabıyıkog˘lu, 2017. Eolianite and coquinite as evidence of MIS 6 and 5, NW Black Sea coast, Turkey. Aeolian research 25, 1-9.",Aeolian Research,2017,,,,EN,,Barbara Mauz,Barbara Mauz,2020-08-31 11:56:49,
